word,Seed,form,definition,definition_2,etymology,example,origin
diffident,Rare,adjective,Modest or shy because of a lack of self-confidence.,,"From Latin diffident- ""lacking confidence"", from the verb diffidere, from dis- ""away"" + fidere ""to trust"".",The diffident student rarely spoke up in class despite knowing the answers.,Latin
dilettante,Rare,noun,A person who cultivates an area of interest without real commitment or knowledge.,,"From Italian dilettante ""lover of the arts"", from dilettare ""to delight"", from Latin delectare.","Though a dilettante in music, he spoke as if he were an expert.",Italian
diligent,Uncommon,,Having or showing care and conscientiousness in one's work or duties.,,"From Latin diligent- 'assiduous', from the verb diligere, from di- 'apart' + legere 'choose'.",,Latin
dissemble,Exotic,verb,Conceal or disguise one's true feelings or beliefs.,"To conceal one's true motives, feelings, or beliefs.","From Latin dissimulare ""to disguise or conceal"", from dis- ""apart"" + simulare ""to copy, represent"".",The politician tried to dissemble when questioned about the scandal.,Latin
dissuade,Rare,,Persuade (someone) not to take a particular course of action.,,,,
duress,Rare,noun,"Threats, violence, constraints, or other action brought to bear on someone to do something against their will or better judgment.",,"From Old French duresse, from Latin duritia ""hardness"", from durus ""hard"".",He signed the confession under duress after hours of interrogation.,Latin
dusk,Uncommon,noun,The darker stage of twilight.,,Old English dox 'dark.',The streetlights flickered on at dusk.,Old English
dwell,Uncommon,verb,Live in or at a specified place.,,"Old English dwellan 'lead astray, hinder.'",They dwell in a small cottage by the sea.,Old English
eager,Uncommon,adjective,Strongly wanting to do or have something.,Wanting to do or have something very much.,Old English eagor 'sharp.',The children were eager for the trip.,Old English
ebullient,Exotic,adjective,Cheerful and full of energy.,Bubbling with enthusiasm or excitement,"From Latin ebullient-, from ebullire ‘bubble out’.",She was ebullient about her new job.,Latin
eclectic,Rare,adjective,"Deriving ideas, style, or taste from a broad and diverse range of sources.",,"From Greek eklektikos, from eklektos ""selected"", from eklegein ""to select"", from ek ""out"" + legein ""to choose"".",Her eclectic taste in music ranged from classical to heavy metal.,Greek
edifice,Rare,,"A large, imposing building.",,"From Latin aedificium, from aedificare 'build', from aedes 'dwelling' + facere 'make'.",,Latin
effrontery,Rare,noun,Insolent or impertinent behavior.,,"From French effronterie, from effronté ‘shameless’.",He had the effrontery to challenge the decision.,French
egregious,Rare,adjective,Outstandingly bad; shocking.,,"From Latin egregius ""outstanding"", from e- ""out of"" + grex, greg- ""flock"".",The referee made an egregious error that changed the outcome of the game.,Latin
elbow,Uncommon,noun,The joint between the forearm and the upper arm.,,Old English elnboga 'elbow.',He leaned on his elbow.,Old English
elide,Exotic,verb,Omit (a sound or syllable) when speaking; join together; merge.,To omit or strike out (a sound or syllable) in pronunciation,"From Latin elidere ""to strike out"", from e- ""out"" + laedere ""to strike"".",The speaker tended to elide the difficult parts of the historical narrative.,Latin
enervate,Rare,verb,To cause (someone) to feel drained of energy; weaken.,To cause weakness or a feeling of exhaustion.,"From Latin enervatus, from e- (variant of ex-) ‘out of’ + nervus ‘sinew’.",The hot sun enervated her to the point of collapse.,Latin
enmity,Rare,noun,The state or feeling of being actively opposed or hostile to someone or something.,A state or feeling of active opposition or hostility.,"From Old French enemite, from Latin inimicitas, from inimicus ""enemy"".",Decades of enmity between the families made reconciliation difficult.,Latin
ephemeral,Rare,adjective,Lasting for a very short time.,Lasting only one day (especially of insects or flowers),From Greek ephēmeros ‘lasting only a day’.,Fame in the world of pop music can be ephemeral.,Greek
eponymous,Rare,adjective,"Giving one's name to a person, place, or thing.","Giving one's name to a tribe, place, or institution.","From Greek epōnumos ""given as a name, giving one's name to someone or something"", from epi ""upon"" + onoma ""name"".",The eponymous character in the novel appears only in the final chapter.,Greek
equanimity,Rare,noun,"Mental calmness, composure, and evenness of temper, especially in a difficult situation.",The quality of being calm and even-tempered,"From Latin aequanimitas, from aequus ‘equal’ + animus ‘mind’.",She accepted the bad news with remarkable equanimity.,Latin
equivocal,Rare,adjective,Open to more than one interpretation; ambiguous.,,"From late Latin aequivocus, from aequi- ""equally"" + vocare ""to call"".",His equivocal response left them uncertain about his position.,Latin
equivocation,Rare,noun,The use of ambiguous language to conceal the truth or to avoid committing oneself; prevarication.,The use of ambiguous language to conceal the truth or to avoid committing oneself.,"From Late Latin aequivocationem, from aequivocus ""ambiguous"", from aequus ""equal"" + vocare ""to call"".",The politician's equivocation on the issue frustrated voters seeking clarity.,Latin
esoteric,Rare,adjective,Intended for or likely to be understood by only a small number of people with a specialized knowledge or interest.,,"From Greek esōterikos ""belonging to an inner circle"", from esōterō ""more within"", comparative of esō ""within"".",The lecture on esoteric philosophical concepts attracted few students.,Greek
eunoia,Exotic,,Beautiful thinking; a well mind.,,"From Greek eunoia 'well mind' or 'beautiful thinking', from eu 'well' + nous 'mind'.",,Greek
evanescent,Rare,adjective,"Soon passing out of sight, memory, or existence; quickly fading or disappearing.",,"From Latin evanescent- ""disappearing"", from the verb evanescere, from e- ""out of"" + vanescere ""vanish"".",The evanescent beauty of the sunset lasted only minutes.,Latin
excursion,Uncommon,,"A short journey or trip, especially one engaged in as a leisure activity.",,"From Latin excursio(n-), from excurrere 'run out', from ex- 'out' + currere 'to run'.",,Latin
execrable,Exotic,adjective,Extremely bad or unpleasant.,Deserving to be denounced as evil or abhorrent.,"From Latin execrabilis, from execrari ""to curse"", from ex- ""out"" + sacrare ""to consecrate"".",The critic described the performance as execrable in every respect.,Latin
exquisite,Uncommon,,"Extremely beautiful and, typically, delicate.",,,,
extol,Rare,verb,Praise enthusiastically.,,"From Latin extollere ""to raise up, elevate"", from ex- ""up"" + tollere ""to raise"".",The biography extolled the virtues of the humanitarian.,Latin
fable,Uncommon,noun,"A short story, typically with animals as characters, conveying a moral.",,From Latin fabula 'story.',The tortoise and the hare is a famous fable.,Latin
facile,Rare,adjective,(Especially of a theory or argument) appearing neat and comprehensive only by ignoring the true complexities of an issue; superficial.,Ignoring the true complexities of an issue; superficial.,"From Latin facilis ""easy"", from facere ""to make"".",He offered facile solutions that ignored the complexity of the problems.,Latin
fain,Rare,,Pleased or willing under the circumstances.,,From Old English fægen 'glad'.,,Old English
falter,Uncommon,,Move unsteadily or in a way that shows a lack of confidence.,,Perhaps from a Scandinavian source; compare Old Norse faltrast 'be encumbered'.,,Scandinavian
fancy,Uncommon,verb,Feel a desire or liking for.,Elaborate in structure or decoration.,From Old French fantasie 'imagination.',Do you fancy a cup of tea?,French
fastidious,Rare,adjective,Very attentive to and concerned about accuracy and detail.,"Reflecting a meticulous, sensitive, or demanding nature","From Latin fastidiosus, from fastidium ‘loathing’.",He chooses his words with fastidious care.,Latin
fathomless,Uncommon,,Too deep to be measured.,,From fathom (Old English fæthm 'outstretched arms') + -less.,,Old English
fatuous,Exotic,adjective,Silly and pointless.,Foolishly vacant or stupid,From Latin fatuus ‘foolish’.,Don't badger people with fatuous questions.,Latin
feckless,Rare,adjective,Lacking initiative or strength of character; irresponsible.,,"From Scottish feck ""effect, value"", from Middle English fek, shortened from effect + -less.",The feckless management team failed to address the company's problems.,Scottish
festoon,Rare,verb,"adorn with chains, garlands, or other decorations","A chain or garland of flowers, leaves, or ribbons, hung in a curve as a decoration.","From French feston, from Italian festone ""a festoon"", from festa ""feast"".",They festooned the hall with garlands for the wedding celebration.,French
flaunt,Rare,,"Display (something) ostentatiously, especially in order to provoke envy or admiration or to show defiance.",,"Origin uncertain, perhaps from Scandinavian, compare Norwegian flanta 'to show off'.",,Scandinavian
flicker,Uncommon,verb,Shine unsteadily; vary rapidly in brightness.,An unsteady movement of a flame or light that causes rapid variations in brightness.,Old English flicorian 'to flutter.',The candlelight flickered in the breeze.,Old English
fluke,Uncommon,,"An unlikely chance occurrence, especially a surprising piece of luck.",,"Origin uncertain, possibly from Middle English fluke 'flatfish'.",,Middle English
forbearance,Rare,noun,Patient self-control; restraint and tolerance.,,"From Old English forberan ""to bear, endure"", from for- + beran ""to bear"".",The teacher showed remarkable forbearance when faced with disruptive students.,Old English
fret,Uncommon,verb,Be constantly or visibly worried or anxious.,,Old English fretan 'devour.',Don't fret; everything will be fine.,Old English
frivolous,Uncommon,,Not having any serious purpose or value.,,"From Latin frivolus 'silly, empty, trifling'.",,Latin
froth,Uncommon,,"A mass of small bubbles in liquid caused by agitation, fermentation, or salivating.",,"From Old Norse froða 'froth, foam'.",,Old Norse
futile,Uncommon,,Incapable of producing any useful result; pointless.,,"From Latin futilis 'leaky, vain, worthless', from fundere 'pour'.",,Latin
garrulous,Rare,adjective,"Excessively talkative, especially on trivial matters.",Given to excessive and often trivial or rambling talk,"From Latin garrulus, from garrire ‘to chatter’.",The garrulous host kept the guests entertained all night.,Latin
genuflect,Exotic,verb,"Lower one's body briefly by bending one knee to the ground, typically in worship or as a sign of respect; show deference or servility.","To bend in deference or respect, especially toward authority.","From Latin genuflectere, from genu ""knee"" + flectere ""to bend"".",Visitors to the cathedral would genuflect before the altar.,Latin
gestalt,Exotic,noun,An organized whole that is perceived as more than the sum of its parts.,"A structure, arrangement, or pattern of physical, biological, or psychological phenomena.","From German Gestalt ""shape, form"".",The therapist focused on the gestalt of the patient's experiences rather than isolated incidents.,German
gleam,Uncommon,verb,"Shine brightly, especially with reflected light.",A flash or beam of light.,"Old English glǣm 'brightness, splendor.'",A gleam of sunlight broke through the clouds.,Old English
glean,Uncommon,verb,Collect gradually and bit by bit.,Gather information or material bit by bit.,"From Old French glener, from Latin glennare 'make a collection.'",She gleaned information from various sources.,French
glee,Uncommon,noun,Great delight.,,"Old English gléo 'entertainment, music.'",She clapped her hands in glee.,Old English
glimpse,Uncommon,verb,See or perceive briefly or partially.,A momentary or partial view.,From Middle English glimsen 'to shine faintly.',She glimpsed a deer in the woods.,Other
goad,Rare,verb,Provoke or annoy (someone) so as to stimulate some action or reaction.,A spiked stick used for driving cattle.,"From Old English gad ""a spike"", of Germanic origin.",She used criticism to goad him into working harder.,Old English
gravid,Exotic,adjective,Pregnant; full of meaning or a specified quality.,Carrying developing young or eggs; pregnant.,"From Latin gravidus ""pregnant"", from gravis ""heavy"".",The gravid female fish sought shallow water to lay her eggs.,Latin
gregarious,Rare,adjective,(Of a person) fond of company; sociable.,Fond of company; sociable.,"From Latin gregarius, from grex ‘flock’.",He was a popular and gregarious man.,Latin
grotto,Rare,,"A small picturesque cave, especially an artificial one in a park or garden.",,"From Italian grotta, via Latin from Greek kruptē 'vault, cavern'.",,Italian/Greek
gulch,Rare,,A narrow and steep-sided ravine marking the course of a fast stream.,,,,
hankering,Rare,,A strong desire to have or do something.,,,,
hapless,Rare,adjective,(Especially of a person) unfortunate.,Having no luck; unfortunate,From Old Norse happ ‘good luck’.,The hapless passengers were stranded at the airport.,Norse
harangue,Rare,noun,A lengthy and aggressive speech.,To deliver a pompous or aggressive speech,"From Italian aringa, from aringare ‘to speak in public’.",He delivered a harangue about the evils of the media.,Italian
harbor,Uncommon,noun,A place on the coast where vessels may find shelter.,"A place on the coast where vessels may find shelter, especially one protected from rough water by piers, jetties, and other artificial structures.","Old English herebeorg 'shelter, lodging.'",The ship sailed into the harbor.,Old English
haughty,Uncommon,,Arrogantly superior and disdainful.,,"From Old French haut 'high', from Latin altus, with -y suffix.",,French/Latin
hectic,Uncommon,,Full of incessant or frantic activity.,,"From Greek hektikos 'habitual', from hexis 'habit, state of mind or body'.",,Greek
heft,Rare,,Weight.,,,,
hegemony,Rare,noun,"leadership or dominance, especially by one country or social group over others. ","Leadership or dominance, especially by one country or social group over others.","From Greek hegemonia ""leadership, rule"", from hegemon ""leader"".",The country sought to establish hegemony over the entire region.,Greek
hirsute,Exotic,,Hairy.,,"From Latin hirsutus 'rough, shaggy'.",,Latin
histrionic,Rare, adjective ,overly theatrical or melodramatic in character or style                                                                                                                                                                                                                                                                                                                                                                                                                                                                                                                                                                                                                                                                       ,Deliberately affected or theatrical,"From Latin histrionicus ""pertaining to an actor"", from histrio ""actor"".",,Latin
histrionic,Exotic,adjective,Excessively theatrical or dramatic in character or style.,Deliberately affected or theatrical,From Latin histrionicus ‘pertaining to actors’.,His histrionic outburst shocked everyone.,Latin
huddle,Uncommon,verb,Crowd together; nestle closely.,,Origin unknown.,The players huddled before the game.,Other
humble,Uncommon,adjective,Having or showing a modest or low estimate of one's importance.,Having or showing a modest or low estimate of one's own importance.,"From Latin humilis 'low, lowly.'",She remained humble despite her success.,Latin
husk,Rare,,The dry outer covering of some fruits or seeds.,,,,
hypochondriac,Rare,,A person who is abnormally anxious about their health.,,"From Greek hypokhondriakos, from hypokhondria 'the abdomen', where melancholy was thought to originate.",,Greek
iconoclast,Rare,noun,A person who attacks cherished beliefs or institutions.,One who attacks cherished beliefs or institutions,"From Greek eikonoklastēs, from eikōn ‘image’ + klan ‘to break’.",The artist was known as an iconoclast in the art world.,Greek
idiom,Rare,,A group of words established by usage as having a meaning not deducible from those of the individual words.,,"From French idiome, or via late Latin from Greek idiōma 'private property, peculiar phraseology', from idiousthai 'make one's own', from idios 'own, private'.",,Greek
idiosyncrasy,Rare,noun,A distinctive or peculiar feature or characteristic of a place or thing; a peculiarity of constitution or temperament.,A mode of behavior or way of thought peculiar to an individual.,"From Greek idiosunkrasia, from idios ""own, private"" + sunkrasis ""mixture, temperament"".",His habit of alphabetizing his spices was just one of his idiosyncrasies.,Greek
idle,Uncommon,adjective,Not active or in use.,Without purpose or effect; pointless.,"Old English īdel 'empty, useless.'",The factory stood idle for months.,Old English
ignominious,Rare,adjective,Deserving or causing public disgrace or shame.,,"From Latin ignominiosus, from ignominia ‘disgrace’.",It was an ignominious end to his career.,Latin
impecunious,Exotic,adjective,Chronically lacking in money; habitually without funds,Chronically lacking financial resources; poor.,"From Latin impecuniosus, from in- ‘not’ + pecunia ‘money’.",He was a gifted but impecunious painter.,Latin
impetuous,Rare,adjective,Acting or done quickly and without thought or care.,,"From late Latin impetuosus, from impetus ""attack"".",The impetuous decision to quit his job left him unemployed for months.,Latin
inchoate,Exotic,adjective,Just begun and so not fully formed or developed; rudimentary.,Just begun and not fully formed; rudimentary.,"From Latin inchoatus, past participle of inchoare ""to begin"".",His inchoate ideas needed more development before presentation.,Latin
incontinent,Rare,,Having no or insufficient voluntary control over urination or defecation.,,,,
indigent,Rare,adjective,Poor; needy.,,"From Latin indigent- ""lacking"", from the verb indigere, from indu- ""within"" + egere ""to need"".",The clinic provided free care to indigent patients.,Latin
indolence,Exotic,noun,Avoidance of activity or exertion; laziness.,,"From Latin indolentia ""freedom from pain"", from in- ""not"" + dolere ""suffer pain"".",Summer indolence overtook the students during vacation.,Latin
indolent,Exotic,adjective,Wanting to avoid activity or exertion; lazy.,Habitually lazy or inactive; averse to exertion.,"From Latin indolent-, from in- ""not"" + dolere ""suffer pain"".",The indolent student rarely completed assignments on time.,Latin
indomitable,Rare,adjective,Impossible to subdue or defeat.,,"From Latin indomitabilis, from in- ""not"" + domitare ""to tame"".",Her indomitable spirit helped her overcome numerous setbacks.,Latin
ineffable,Rare,adjective,Too great or extreme to be expressed or described in words.,Too sacred to be uttered; forbidden to be spoken,"From Latin ineffabilis, from in- ‘not’ + effabilis ‘able to be expressed’.",The beauty of the sunset was ineffable.,Latin
inexorable,Rare,adjective,Impossible to stop or prevent.,,"From Latin inexorabilis, from in- ""not"" + exorabilis ""able to be entreated"", from exorare ""to prevail upon"".",The inexorable advance of technology transformed the industry.,Latin
infidel,Rare,,A person who does not believe in religion or who adheres to a religion other than one's own.,,,,
inimical,Rare, adjective ,Tending to obstruct or harm; unfriendly; hostile.,Tending to obstruct or harm.,"From Latin inimicalis, from inimicus ""enemy"", from in- ""not"" + amicus ""friend"".",The dictator's policies were inimical to democratic principles.,Latin
inlet,Uncommon,noun,"A small arm of the sea, a lake, or a river.",,From Old English inlæt 'entrance.',The boat sailed into the inlet.,Old English
inscrutable,Rare,adjective,Impossible to understand or interpret.,,"From Latin inscrutabilis, from in- ""not"" + scrutari ""to examine"".",His inscrutable expression gave no hint of his thoughts.,Latin
insidious,Rare,adjective,"Proceeding in a gradual, subtle way, but with harmful effects.",,"From Latin insidiosus, from insidiae ""ambush"", from insidere ""to lie in wait for"", from in- ""in"" + sedere ""to sit"".",The insidious spread of misinformation undermined public trust.,Latin
interstitial,Rare,,"Relating to or situated in the small, narrow spaces between tissues or parts of an organ.",,"From Latin interstitium, from inter- 'between' + sistere 'to stand'.",,Latin
intransigent,Rare,adjective,Unwilling or refusing to change one's views or to agree about something.,Refusing to compromise or agree; inflexible.,"From French intransigeant, from Spanish intransigente.",The negotiations broke down due to both sides being intransigent.,French
inure,Rare,verb,"Accustom (someone) to something, especially something unpleasant.","To accustom (someone) to something, especially something unpleasant.","From Middle English inure ""to come into use"", from in- + ure ""use, practice"".",Years of hardship had inured him to discomfort.,Other
inveigle,Exotic,verb,Persuade (someone) to do something by means of deception or flattery.,"To win over by wiles, flattery, or artful talk.","From French aveugler ""to blind"", from Old French, from a- (from Latin ad- ""to"") + aveugle ""blind"".",He tried to inveigle his way into the exclusive club.,French
inveterate,Rare,adjective,"having a particular habit, activity, or interest that is long-established and unlikely to change ","Having a particular habit, activity, or interest that is long-established and unlikely to change.","From Latin inveteratus ""of long standing"", past participle of inveterare ""to make old"", from in- ""in"" + vetus ""old"".",The inveterate gambler could not resist placing one more bet.,Latin
irascible,Rare, adjective ,"having or showing a tendency to be easily angered, very irritable                                                                                                                                                                                                                                                                                                                                                                                                                                                                                                                                                                                                                                                                                                                                                                                                                                                                                                                                    ",Having or showing a tendency to be easily angered.,"From Latin irascibilis, from irasci ""to be angry"", from ira ""anger"".",The irascible old man shouted at children who stepped on his lawn.,Latin
ishtmus,Rare,,"A narrow strip of land with sea on either side, forming a link between two larger areas of land.",,"From Latin isthmus, from Greek isthmos 'neck of land'.",,Greek
jingoism,Rare,noun,"Extreme patriotism, especially in the form of aggressive or warlike foreign policy.",,"From jingo, a word used in a popular song supporting British policy during the Russo-Turkish War (1877–78).",The newspaper's jingoism during wartime discouraged any criticism of military actions.,Other
jolly,Uncommon,adjective,Happy and cheerful.,,From Old French jolif 'festive.',He was in a jolly mood.,French
jolt,Uncommon,verb,Push or shake abruptly and roughly.,Push or shake (someone or something) abruptly and roughly.,Origin unknown.,The bus jolted to a stop.,Other
juggle,Uncommon,verb,Continuously toss into the air and catch.,,From Old French jogler 'to entertain.',He can juggle three balls at once.,French
juxtapose,Rare,verb,To place or deal with close together for contrasting effect.,,"From French juxtaposer, from Latin juxta ‘next’ + French poser ‘to place’.",The exhibition juxtaposes modern art with classical sculpture.,Latin
kaleidoscope,Rare,noun,A constantly changing pattern or sequence of objects or elements.,A succession of changing phases or actions,From Greek kalos ‘beautiful’ + eidos ‘form’ + skopein ‘to look at’.,The city lights formed a kaleidoscope of colors.,Greek
keen,Uncommon,adjective,Having or showing eagerness or enthusiasm.,,"Old English cene 'bold, brave.'",She has a keen interest in science.,Old English
kindle,Uncommon,verb,Light or set on fire.,,Old Norse kynda 'to kindle.',She kindled a fire in the hearth.,Other
kismet,Exotic,noun,Destiny; fate.,,"From Turkish, from Arabic qisma ‘division, portion, fate’.",It was kismet that they met that day.,Arabic
knack,Uncommon,noun,An acquired or natural skill at performing a task.,An acquired or natural skill at doing something.,From Middle English knak 'sharp sound.',She has a knack for painting.,Other
knot,Uncommon,noun,"A fastening made by tying a piece of string, rope, or something similar.",,Old English cnotta 'knot.',She tied a knot in the rope.,Old English
lachrymose,Exotic,adjective,Tearful or given to weeping; inducing tears.,Given to shedding tears; mournful.,"From Latin lacrimosus, from lacrima ""tear"".",The lachrymose widow could not be consoled at the funeral.,Latin
laconic,Exotic,adjective,Using very few words.,Using minimal words; terse.,"From Greek Lakōnikos, referring to the Spartans, who were known for their terse speech.",Her laconic reply left everyone in the room puzzled.,Greek
