word,Seed,form,definition,definition_2,etymology,example,origin
abrogate,Exotic,verb,"To repeal or do away with (a law, right, or formal agreement).",To abolish by authoritative action,"From Latin abrogat-, from abrogare ‘repeal’.",The treaty was abrogated in 1929.,Latin
abstemious,Exotic, adjective ," Not self-indulgent, especially when eating or drinking                                                                                                                                                                                                                                                                                                                                                                                                                                                                                                                                                                                                                                                                                                                                                                                                                                                                                                                                               ",Marked by restraint especially in the consumption of food or alcohol.,"From Latin abstemius, from ab- ""away from"" + stem of temetum ""intoxicating drink"".",His abstemious lifestyle included neither alcohol nor rich foods.,Latin
acerbic,Rare, adjective , (especially of a comment or style of speaking) sharp and forthright                                                                                                                                                                                                                                                                                                                                                                                                                                                                                                                                                                                                                                                   ,Sharp and forthright.,"From Latin acerbus ""bitter, harsh, sour"", from acer ""sharp"".",The critic was known for acerbic reviews that spared no one's feelings.,Latin
acrid,Rare,,Having an irritatingly strong and unpleasant taste or smell.,,,,
adamant,Rare,adjective,Refusing to be persuaded or to change one's mind.,,From Greek adamas ‘untameable’.,He is adamant that he is not going to resign.,Greek
admonish,Rare,verb,Warn or reprimand someone firmly.,To warn or reprimand someone firmly.,"From Latin admonere ""to remind, warn"", from ad- ""to"" + monere ""warn"".",The teacher admonished students who hadn't completed their homework.,Latin
adulterous,Uncommon,,Characterized by or involving adultery.,,"From Latin adulterare 'to corrupt', from ad- 'towards' + alterare 'to alter'.",,Latin
adventitious,Exotic,adjective,Coming from outside; not native; associated by chance rather than design.,Arising from an external source rather than inherent causes.,"From Latin adventicius ""coming from abroad"", from adventus, past participle of advenire ""to come to"".",The adventitious discovery of penicillin revolutionized medicine.,Latin
aegis,Rare,noun,"The protection, backing, or support of a particular person or organization.",,"From Greek aigis, the shield of Zeus or Athena.",The project proceeded under the aegis of the National Science Foundation.,Greek
affective,Rare,adjective,"Relating to moods, feelings, and attitudes.",,"From Latin affect- ""influenced, affected"", from the verb afficere, from ad- ""to"" + facere ""to make"".",The therapy focused on affective responses to traumatic memories.,Latin
alacrity,Rare,noun,Brisk and cheerful readiness.,,"From Latin alacritas, from alacer ""brisk, lively"".",She accepted the challenging assignment with alacrity.,Latin
altruism,Uncommon,,Disinterested and selfless concern for the well-being of others.,,"From French altruisme, from Italian altrui 'somebody else', from Latin alteri huic 'to this other'.",,French/Italian/Latin
ambivalent,Rare,adjective,Having mixed feelings or contradictory ideas about something or someone.,,"From Latin ambi- ""both"" + valentia ""strength"", from valere ""be strong"".","She felt ambivalent about the job offer, seeing both advantages and drawbacks.",Latin
amble,Uncommon,verb,"Walk or move at a slow, relaxed pace.",,Old French ambler 'to walk as a horse does.',They amble along the riverbank.,French
amorphous,Rare,adjective,Without a clearly defined shape or form.,,"From Greek amorphos ""shapeless"", from a- ""without"" + morphē ""form"".",The amorphous blob slowly took shape as the artist refined the sculpture.,Greek
ample,Uncommon,,Enough or more than enough; plentiful.,,"From French ample, from Latin amplus 'large, abundant'.",,Latin
anachronistic,Rare,adjective,belonging to a period other than that being portrayed,Belonging to a period other than that being portrayed.,"From Greek anakhronismos, from ana- ""against"" + khronos ""time"".",The film contained anachronistic elements like modern slang in a medieval setting.,Greek
anathema,Exotic,noun,"Something or someone that one vehemently dislikes; a formal curse by a pope or a council of the Church, excommunicating a person or denouncing a doctrine.","A formal ecclesiastical ban, curse, or excommunication.","From Greek anathema ""a thing devoted"", in later Greek ""a thing accursed"".",His liberal views were anathema to the conservative community.,Greek
antebellum,Exotic,adjective,"Occurring or existing before a particular war, especially the American Civil War.","Belonging to the period before a war, especially the American Civil War.","From Latin ante ""before"" + bellum ""war"".",The antebellum mansion had been preserved as a historical monument.,Latin
antecedent,Rare,,A thing or event that existed before or logically precedes another.,,"From Latin antecedentem 'going before', from antecedere, from ante 'before' + cedere 'to go'.",,Latin
antediluvian,Exotic,adjective,Ridiculously old-fashioned; of or belonging to the time before the biblical Flood.,So old or old-fashioned as to appear to belong to a former age,From Latin ante ‘before’ + diluvium ‘flood’.,He still uses antediluvian methods in his research.,Latin
antipathy,Rare,noun,A deep-seated feeling of dislike; aversion.,,"From Greek antipatheia, from anti- ""against"" + pathos ""feeling"".",She felt an instinctive antipathy toward her mother's new boyfriend.,Greek
aphorism,Rare, noun      ,"a pithy observation that contains a general truth, such as, “if it ain't broke, don't fix it.”.                                                                                                                                                                                                                                                                                                                                                                                                                                                                                                                                                                                                                          ",A pithy observation that contains a general truth.,"From Greek aphorismos ""definition, pithy sentence"", from aphorizein ""to mark off, divide"".",Benjamin Franklin's aphorisms continue to be quoted centuries later.,Greek
aplomb,Rare,noun,"Self-confidence or assurance, especially when in a demanding situation.",,"From French à plomb ""according to a plumb line"", from à ""to"" + plomb ""lead weight"".","She handled the crisis with remarkable aplomb, never losing her composure.",French
apocryphal,Rare,adjective,"(Of a story or statement) of doubtful authenticity, although widely circulated as being true.",Being of questionable authenticity,From Greek apokruphos ‘hidden’.,The story of the haunted house is probably apocryphal.,Greek
aporia,Exotic, noun      ,"An irresolvable internal contradiction or logical disjunction in a text, argument, or theory                                                                                                                                                                                                                                                                                                                                                                                                                                                                                                                                                                                                                                                                                                                                                                                                                                                                                                         ",A logical impasse or contradiction; a puzzle without a clear solution.,"From Greek aporia ""difficulty, perplexity"", from aporos ""impassable"", from a- ""without"" + poros ""passage"".",The philosophical aporia left the students in a state of puzzlement.,Greek
apotheosis,Rare,noun,The elevation of someone to divine status; the highest point in the development of something; culmination or climax.,The highest point in the development of something; culmination or climax.,"From Greek apotheōsis ""deification"", from apotheoun ""deify"", from apo- ""completely"" + theos ""god"".",The championship victory represented the apotheosis of his career.,Greek
apparition,Rare,,A ghost or ghostlike image of a person.,,"From Latin apparitio(n-), from apparere 'appear'.",,Latin
arable,Rare,adjective,(Of land) used or suitable for growing crops.,Suitable for growing crops.,"From Latin arabilis, from arare ""to plow"".",The region's arable land produced abundant crops.,Latin
ardor,Rare,,Enthusiasm or passion.,,"From Latin ardor 'heat, enthusiasm', from ardere 'to burn'.",,Latin
articulate,Uncommon,,Having or showing the ability to speak fluently and coherently.,,,,
asperity,Exotic,noun,Harshness of tone or manner; severity of character or attitude.,Roughness of manner; harshness of temper,"From Latin asperitas, from asper ""rough"".",He responded with asperity to the criticism of his work.,Latin
assiduous,Exotic,adjective,"Showing great care, attention, and effort.",Marked by careful unremitting attention or persistent application.,"From Latin assiduus ""constant"", from assidere ""to sit down to"", from ad- ""to"" + sedere ""to sit"".",Her assiduous study habits earned her top marks in the class.,Latin
astringent,Rare,adjective,"Causing the contraction of body tissues, typically of the skin; severe or stern in manner.","Causing the contraction of body tissues, typically of the skin.","From Latin astringent- ""binding"", from the verb astringere, from ad- ""to"" + stringere ""to bind"".",The astringent lotion helped clear up his skin condition.,Latin
atavistic,Rare,adjective, Relating to or characterized by reversion to something ancient or ancestral                                                                                                                                                                                                                                                                                                                                                                                                                                                                                                                                                                                                                                                                                                                                                                                                                                                                                                                          ,Relating to or characterized by reversion to something ancient or ancestral.,"From Latin atavus ""ancestor"", from at- (beyond) + avus ""grandfather"".",The riot revealed atavistic impulses normally suppressed by civilization.,Latin
audacity,Uncommon,,A willingness to take bold risks.,,"From Latin audacitas, from audax 'bold', from audere 'dare'.",,Latin
auspicious,Rare,adjective,Conducive to success; favorable.,,"From Latin auspicium ""divination by observing birds"", from auspex ""bird seer"".",The project had an auspicious beginning with strong initial funding.,Latin
austere,Rare,adjective,"Severe or strict in manner, attitude, or appearance; having no comforts or luxuries; harsh or ascetic.","Severe or strict in manner, attitude, or appearance.","From Latin austerus, from Greek austēros ""harsh, severe"".",The monastery's austere furnishings reflected the monks' vow of poverty.,Greek
avuncular,Exotic,adjective,kind and friendly toward a younger or less experienced person.,Suggestive of an uncle's kindness or indulgence toward a younger person.,"From Latin avunculus ""maternal uncle"", diminutive of avus ""grandfather"".",The older colleague offered avuncular advice to the new employees.,Latin
balk,Rare,,Hesitate or be unwilling to accept an idea or undertaking.,,"From Old English balca 'ridge, bank'.",,Old English
bask,Uncommon,verb,"Lie exposed to warmth and light, typically from the sun.","Lie exposed to warmth and light, typically from the sun, for relaxation and pleasure.",Old Norse bask 'to bathe.',The lizard basked in the sun.,Other
bastion,Rare,,"A projecting part of a fortification built at an angle to the line of a wall, so as to allow defensive fire in several directions.",,"From French bastion, from Italian bastione, from bastire 'to build'.",,French/Italian
beatific,Rare,adjective,Showing or producing exalted joy or blessedness.,,"From Latin beatificus, from beatus ""blessed"" + -ficus ""-making"".",The saint wore a beatific smile as she greeted her followers.,Latin
beguiling,Rare,adjective,"Charming or enchanting, often in a deceptive way.",,"From Middle Dutch begīlen ""to deceive"".",The beguiling melody attracted listeners from across the park.,Dutch
bellicose,Rare,adjective, Demonstrating aggression and willingness to fight                                                                                                                                                                                                                                                                                                                                                                                                                                                                                                                                                                                                                                                                                                                                                                                                                                                                                                                                                    ,Demonstrating aggression and willingness to fight.,"From Latin bellicosus, from bellicus ""of war"", from bellum ""war"".",The bellicose rhetoric from both countries raised fears of war.,Latin
benevolent,Uncommon,,Well meaning and kindly.,,"From Latin benevolent- 'well wishing', from bene 'well' + volent- 'wishing', from the verb velle.",,Latin
bequeath,Rare,,Leave (property) to a person or other beneficiary by a will.,,,,
bereft,Rare,adjective,"Deprived of or lacking something, especially a non-material asset.",,"Past participle of bereave, from Old English bereafian, from be- + reafian ""to rob, plunder"".","After his wife's death, he felt bereft of purpose.",Old English
bifurcate,Exotic,verb,Divide into two branches or forks.,To divide into two branches or parts.,"From late Latin bifurcatus, past participle of bifurcare, from bi- ""two"" + furca ""fork"".","The path would bifurcate at the old oak tree, leading to different villages.",Latin
bilious,Exotic,adjective,"spiteful, bad-tempered",Affected by or associated with nausea or vomiting,"From Latin biliosus, from bilis ""bile"". Originally referred to an excess of bile, thought to cause irritability.",His bilious temperament made him difficult to work with.,Latin
bilk,Rare,verb,Cheat or defraud (someone).,To cheat or defraud.,"Perhaps from Old English *bilican ""to deceive"", or from the card game of cribbage, where it meant ""to spoil someone's score"".",The con artist tried to bilk elderly victims out of their savings.,Old English
bivouac,Rare,,"A temporary camp without tents or cover, used especially by soldiers or mountaineers.",,,,
blandishment,Exotic,noun,A flattering or pleasing statement or action used to persuade someone gently to do something.,Speech or action that flatters and tends to coax,"From French blandissement, from blandir ‘to flatter’.",She used every blandishment to get her way.,French
blithe,Exotic,adjective,Showing a casual and cheerful indifference considered to be callous or improper; happy or joyous.,Showing a casual and cheerful indifference considered to be callous or improper.,"From Old English bliþe ""joyful, kind, gentle, pleasant"", of Germanic origin.",She remained blithe about the potential dangers of the expedition.,Old English
bloom,Uncommon,verb,Produce flowers; be in flower.,"A flower, especially one cultivated for its beauty.",Old Norse blóm 'flower.',The cherry trees bloom in April.,Other
bombastic,Rare,adjective,High-sounding but with little meaning; inflated.,,From Middle French bombaste ‘cotton padding’.,His bombastic rhetoric concealed his lack of ideas.,French
brisk,Uncommon,adjective,"Active, fast, and energetic.",,"Origin unknown, perhaps imitative.",She took a brisk walk in the park.,Other
byzantine,Rare,adjective,highly complex or intricate and occasionally devious,"Excessively complicated, typically involving a great deal of administrative detail.","From Byzantine, relating to Byzantium (Constantinople), known for complex administration and intrigue.",The tax code's byzantine complexity confuses even experts.,Greek
cacophony,Rare,noun,"A harsh, discordant mixture of sounds.",,"From Greek kakophōnia, from kakos ‘bad’ + phōnē ‘voice’.",A cacophony of car horns filled the air.,Greek
cajole,Rare,verb,Persuade (someone) to do something by sustained coaxing or flattery.,,"From French cajoler, perhaps from Picard ""to chatter like a jay"", from gajole ""cage"".",She had to cajole her reluctant child into trying new foods.,French
capitulate,Rare,verb,Cease to resist an opponent or an unwelcome demand; surrender.,To surrender under agreed conditions.,"From Latin capitulatus, from capitulum ‘chapter, heading’.",The enemy was forced to capitulate unconditionally.,Latin
carouse,Rare,,"Drink plentiful amounts of alcohol and enjoy oneself with others in a noisy, lively way.",,"From German gar aus 'right out', used as a drinking toast.",,German
cataract,Rare,,A large waterfall.,,,,
cavort,Rare,verb,Jump or dance around excitedly.,,"Perhaps from curvet, from Italian corvetta ""a leap"", from Latin curvus ""curved"".",Children cavorted in the spray from the fountain.,Other
chagrin,Rare,noun,annoyance or distress at having failed or been humiliated,Annoyance or distress at having failed or been humiliated.,"From French chagrin ""melancholy, anxiety"", possibly from Old French graigne ""sadness"".","To his chagrin, his presentation was interrupted by technical difficulties.",French
chastity,Rare,,"The state or practice of refraining from extramarital, or especially from all, sexual intercourse.",,,,
chauvinist,Rare,noun,A person displaying aggressive or exaggerated patriotism; a person displaying excessive or prejudiced support for their own cause or group.,A person displaying aggressive or exaggerated patriotism.,"From French chauvinisme, named after Nicolas Chauvin, a legendary French soldier and patriot.",The chauvinist believed his country superior to all others.,French
chromatic,Rare,,Relating to or produced by color.,,"From Greek khrōmatikos, from khrōma 'color'.",,Greek
circumscribe,Rare,verb,Restrict (something) within limits.,To draw a line around; to encircle completely,"From Latin circumscribere, from circum ‘around’ + scribere ‘write’.",The rules circumscribe the powers of the committee.,Latin
clutch,Uncommon,verb,Grasp or seize (something) tightly or eagerly.,A tight grasp.,Old English clyccan 'to clench.',She clutched her bag tightly.,Old English
cogent,Exotic,adjective,"(Of an argument or case) clear, logical, and convincing.",Appealing forcibly to the mind or reason; convincing.,"From Latin cogent-, from cogere ‘drive together’.",She presented a cogent argument for the new policy.,Latin
cogitate,Rare,verb,"Think deeply about something, meditate or reflect",To think deeply about something; meditate or reflect.,"From Latin cogitatus, past participle of cogitare ""to think"", from co- ""together"" + agitare ""to turn over, consider"".",The philosopher would cogitate for hours on ethical dilemmas.,Latin
commensurate,Rare,adjective,Corresponding in size or degree; in proportion.,,"From Latin commensuratus, from com- ""together"" + mensuratus ""measured"".",The salary was commensurate with his experience and qualifications.,Latin
compunction,Rare,noun,A feeling of guilt or moral scruple that prevents or follows the doing of something bad.,,"From Latin compunctio(n-), from the verb compungere, from com- ""together"" + pungere ""to prick"".",The thief showed no compunction about stealing from the elderly.,Latin
conjoint,Rare,,Joined together; joint.,,"From French conjoint 'united', from Latin conjunctus, past participle of conjungere 'to join together'.",,French/Latin
consolation,Uncommon,,The comfort received by a person after a loss or disappointment.,,"From Latin consolatio(n-), from consolari 'to comfort'.",,Latin
contrite,Exotic,adjective,Feeling or expressing remorse or penitence; affected by guilt.,,"From Latin contritus ""worn out, ground down"", from the verb conterere, from con- ""together"" + terere ""to rub"".",The contrite child apologized for breaking the vase.,Latin
convivial,Rare,adjective,"Friendly, lively, and enjoyable; (of a person) cheerful and friendly; jovial.","Friendly, lively, and enjoyable.","From Latin convivialis, from convivium ""a feast"", from con- ""with"" + vivere ""to live"".",The convivial atmosphere at the party put everyone at ease.,Latin
copious,Uncommon,,Abundant in supply or quantity.,,"From Latin copiosus, from copia 'plenty'.",,Latin
copulate,Rare,,Have sexual intercourse.,,,,
cosmopolitan,Rare,,Familiar with and at ease in many different countries and cultures.,,"From Greek kosmopolitēs 'citizen of the world', from kosmos 'world' + politēs 'citizen'.",,Greek
creed,Rare,,A system of Christian or other religious belief; a faith.,,From Latin credo 'I believe'.,,Latin
cusp,Rare,,A pointed end where two curves meet.,,"From Latin cuspis 'point, apex'.",,Latin
daguerreotype,Exotic,,A photograph taken by an early photographic process employing an iodine-sensitized silvered plate and mercury vapor.,,"Named after Louis Daguerre (1787–1851), French pioneer of photography.",,French
dandy,Uncommon,adjective,Excellent; first-rate.,"A man unduly devoted to style, neatness, and fashion in dress and appearance.","Origin unknown, perhaps from French.",He looked dandy in his new suit.,French
dazzle,Uncommon,verb,Blind (a person) temporarily.,Brightness that blinds someone temporarily.,From Old French daseler 'to daze.',The bright lights dazzled the audience.,French
deign,Rare,verb,Do something that one considers to be beneath one's dignity.,,"From Old French deignier, from Latin dignari ""to consider worthy"", from dignus ""worthy"".",The celebrity wouldn't deign to speak to ordinary fans.,Latin
deleterious,Rare,adjective,Causing harm or damage.,,From Greek dēlētērios ‘noxious’.,Divorce is assumed to have deleterious effects on children.,Greek
demagogue,Rare,noun,A political leader who seeks support by appealing to popular desires and prejudices rather than by using rational argument.,A leader who makes use of popular prejudices and false claims and promises,"From Greek dēmagōgos, from dēmos ‘people’ + agōgos ‘leading’.",The demagogue stirred up the crowd with fiery rhetoric.,Greek
demure,Exotic,,"Reserved, modest, and shy.",,"From Old French demoure 'settled, serious, grave', past participle of demourer 'to stay', from Latin demorari.",,French/Latin
depredation,Rare,noun,An act of attacking or plundering.,,"From Latin depraedatio(n-), from the verb depraedari, from de- ""completely"" + praedari ""plunder"".",Farmers complained about the depredations of wild boars on their crops.,Latin
diaphanous,Exotic,adjective,"(Especially of fabric) light, delicate, and translucent.",So fine in texture as to allow light to pass through.,"From medieval Latin diaphanus, from Greek diaphanēs ""transparent"", from dia ""through"" + phainein ""to show"".",She wore a diaphanous gown that caught the evening light.,Greek
diastole,Exotic,,The phase of the heart's cycle during which the heart muscle relaxes and allows the chambers to fill with blood.,,"From Greek diastolē 'dilatation', from diastellein 'to expand'.",,Greek
didactic,Rare,adjective,"Intended to teach, particularly in having moral instruction as an ulterior motive.",,"From Greek didaktikos, from didaskein ‘to teach’.",The novel had a didactic purpose.,Greek
